{
  "schema_version": "0.2.0",
  "snapshot_id": "sha256:fixture",
  "repository_id": "repo:1",
  "repository": "sample/project",
  "pull_request_number": 1,
  "base_sha": "aaaaaaaaaaaaaaaaaaaaaaaaaaaaaaaaaaaaaaaa",
  "head_sha": "bbbbbbbbbbbbbbbbbbbbbbbbbbbbbbbbbbbbbbbb",
  "merge_base_sha": "cccccccccccccccccccccccccccccccccccccccc",
  "selection_policy_id": "default-v1",
  "state": "READY",
  "created_at": "2026-10-16T00:00:00Z",
  "files": [
    {
      "path": "a.ts",
      "previous_path": null,
      "status": "modified",
      "scope": "INCLUDED",
      "patch_available": true,
      "patch_sha256": "ffffffffffffffffffffffffffffffffffffffffffffffffffffffffffffffff",
      "binary": false,
      "additions": 3,
      "deletions": 2,
      "line_map_available": true,
      "content_state": "AVAILABLE",
      "scope_reason": null
    },
    {
      "path": "b.ts",
      "previous_path": null,
      "status": "modified",
      "scope": "INCLUDED",
      "patch_available": true,
      "patch_sha256": "ffffffffffffffffffffffffffffffffffffffffffffffffffffffffffffffff",
      "binary": false,
      "additions": 3,
      "deletions": 2,
      "line_map_available": true,
      "content_state": "AVAILABLE",
      "scope_reason": null
    }
  ],
  "evidence_coverage": {
    "reported_changed_files": 2,
    "enumerated_changed_files": 2,
    "included": 2,
    "excluded_by_policy": 0,
    "unavailable": 0,
    "excluded_reasons": [],
    "diff_integrity": "VERIFIED",
    "line_anchor_integrity": "VERIFIED",
    "manifest_digest": "dddddddddddddddddddddddddddddddddddddddddddddddddddddddddddddddd"
  },
  "evidence_ledger_digest": "eeeeeeeeeeeeeeeeeeeeeeeeeeeeeeeeeeeeeeeeeeeeeeeeeeeeeeeeeeeeeeee",
  "limitations": []
}
